id,order,start_at,script_jp,script_en
playerenglishnews_3_30073_1,1,0,"今年は英語の能力を上げようと計画している人もいるだろう。","Some of you may be planning to improve your English skills this year."
playerenglishnews_3_30073_2,2,4450,"そのための効果的な方法を知りたいかもしれない。","You might want to know the effective way of doing so."
playerenglishnews_3_30073_3,3,8145,"単語の学習であれリスニング能力の向上であれ、重要なのは10分でも良いので毎日勉強し、勉強したことを復習することだ。","Whether you want to learn vocabulary or improve your listening skills, what's important is to study even just 10 minutes every day, and review what you learned."
playerenglishnews_3_30073_4,4,19368,"エビングハウスの忘却曲線について聞いたことがあるかもしれない。","You may have heard about Ebbinghaus' forgetting curve before."
playerenglishnews_3_30073_5,5,23961,"学習された内容のほとんどは、復習されなければ人間の記憶から数日で消えてしまうことを示す図である。","It's a graph that illustrates that most things learned disappears from the human memory in a few days, unless reviewed."
playerenglishnews_3_30073_6,6,32430,"ゆえに、このアプリの記事を一度しか聞かないのはあなたが期待するほど効果的でないかもしれない。","Therefore, listening to an article in this app only once may not be effective as you may expect."
playerenglishnews_3_30073_7,7,39712,"同じ記事を何日か連続で聞いたほうが良い。","It would be better to listen to the same article for a few consecutive days."
playerenglishnews_3_30073_8,8,45240,"これはあなたが語彙や表現を習得し、リスニング能力を向上する手助けとなるはずだ。","This should help you acquire vocabulary and expressions, and improve your listening skills."
playerenglishnews_3_30073_9,9,52057,"ぜひ、この学習<b>法*</b>を試していただきたい。","Please give this learning <b>method*</b> a try."
